Movie Rank,Movie Name,Year Released,User Rating,Genre,Director,Gross Amount(Millions),Actor1,Actor2,Actor3,Actor4
220,My Neighbor Totoro,1988,G,Animation,Hayao Miyazaki,1.11,Hitoshi Takagi, Noriko Hidaka, Chika Sakamoto, Shigesato Itoi
221,Ben-Hur,1959,G,Adventure,William Wyler,74.7,Charlton Heston, Jack Hawkins, Stephen Boyd, Haya Harareet
222,Cool Hand Luke,1967,GP,Crime,Stuart Rosenberg,16.22,Paul Newman, George Kennedy, Strother Martin, J.D. Cannon
223,Network,1976,R,Drama,Sidney Lumet,NULL,Faye Dunaway, William Holden, Peter Finch, Robert Duvall
224,La haine,1995,Not Rated,Crime,Mathieu Kassovitz,0.31,Vincent Cassel, Hubert Koundé, Saïd Taghmaoui, Abdel Ahmed Ghili
225,The Iron Giant,1999,PG,Animation,Brad Bird,23.16,Eli Marienthal, Harry Connick Jr., Jennifer Aniston, Vin Diesel
226,Before Sunset,2004,R,Drama,Richard Linklater,5.82,Ethan Hawke, Julie Delpy, Vernon Dobtcheff, Louise Lemoine Torrès
227,Persona,1966,Not Rated,Drama,Ingmar Bergman,NULL,Bibi Andersson, Liv Ullmann, Margaretha Krook, Gunnar Björnstrand
228,The Seventh Seal,1957,Not Rated,Drama,Ingmar Bergman,NULL,Max von Sydow, Gunnar Björnstrand, Bengt Ekerot, Nils Poppe
229,Hotel Rwanda,2004,PG-13,Biography,Terry George,23.53,Don Cheadle, Sophie Okonedo, Joaquin Phoenix, Xolani Mali
230,Amores Perros,2000,R,Drama,Alejandro G. Iñárritu,5.38,Emilio Echevarría, Gael García Bernal, Goya Toledo, Álvaro Guerrero
231,The Bridge on the River Kwai,1957,PG,Adventure,David Lean,44.91,William Holden, Alec Guinness, Jack Hawkins, Sessue Hayakawa
232,The Third Man,1949,Approved,Film-Noir,Carol Reed,0.45,Orson Welles, Joseph Cotten, Alida Valli, Trevor Howard
233,In the Name of the Father,1993,R,Biography,Jim Sheridan,25.01,Daniel Day-Lewis, Pete Postlethwaite, Alison Crosbie, Philip King
234,The Grapes of Wrath,1940,Passed,Drama,John Ford,0.06,Henry Fonda, Jane Darwell, John Carradine, Charley Grapewin
235,Rebecca,1940,Approved,Drama,Alfred Hitchcock,4.36,Laurence Olivier, Joan Fontaine, George Sanders, Judith Anderson
236,On the Waterfront,1954,Approved,Crime,Elia Kazan,9.6,Marlon Brando, Karl Malden, Lee J. Cobb, Rod Steiger
237,Mary and Max,2009,Not Rated,Animation,Adam Elliot,NULL,Toni Collette, Philip Seymour Hoffman, Eric Bana, Barry Humphries
238,The 400 Blows,1959,Not Rated,Crime,François Truffaut,NULL,Jean-Pierre Léaud, Albert Rémy, Claire Maurier, Guy Decomble
239,It Happened One Night,1934,Passed,Comedy,Frank Capra,4.36,Clark Gable, Claudette Colbert, Walter Connolly, Roscoe Karns
240,The Best Years of Our Lives,1946,Approved,Drama,William Wyler,23.65,Myrna Loy, Dana Andrews, Fredric March, Teresa Wright
241,Wild Strawberries,1957,Not Rated,Drama,Ingmar Bergman,NULL,Victor Sjöström, Bibi Andersson, Ingrid Thulin, Gunnar Björnstrand
242,Mr. Smith Goes to Washington,1939,Passed,Comedy,Frank Capra,9.6,James Stewart, Jean Arthur, Claude Rains, Edward Arnold
243,The Battle of Algiers,1966,Not Rated,Drama,Gillo Pontecorvo,0.06,Brahim Hadjadj, Jean Martin, Yacef Saadi, Samia Kerbash
244,The General,1926,Passed,Action,Clyde Bruckman,1.03,Buster Keaton, Marion Mack, Glen Cavender, Jim Farley
245,The Gold Rush,1925,Passed,Adventure,Charles Chaplin,5.45,Charles Chaplin, Mack Swain, Tom Murray, Henry Bergman
246,The Incredibles,2004,PG,Animation,Brad Bird,261.44,Craig T. Nelson, Samuel L. Jackson, Holly Hunter, Jason Lee
247,Dances with Wolves,1990,PG-13,Adventure,Kevin Costner,184.21,Kevin Costner, Mary McDonnell, Graham Greene, Rodney A. Grant
248,Aladdin,1992,G,Animation,Ron Clements,217.35,Scott Weinger, Robin Williams, Linda Larkin, Jonathan Freeman
249,Life of Brian,1979,R,Comedy,Terry Jones,20.05,Graham Chapman, John Cleese, Michael Palin, Terry Gilliam
250,Groundhog Day,1993,PG,Comedy,Harold Ramis,70.91,Bill Murray, Andie MacDowell, Chris Elliott, Stephen Tobolowsky
